{"v":1,"id":"synthwave","rev":6,"p":[{"t":"sp","x":0,"y":0,"w":240,"h":128,"a":"/themes/u/syn-top.cbi"},{"t":"tx","x":4,"y":6,"w":232,"b":"l","s":2,"f":2,"ft":"shrink","al":"center","c":"#FF4FA3","h":32,"va":"middle"},{"t":"tx","x":78,"y":42,"v":"USAGE","s":1,"f":4,"c":"#FF4FA3"},{"t":"p","x":18,"y":157,"w":153,"h":20,"sl":1,"b":"us1p","c":"#FF4FA3","bg":"#1D073B","bc":"#FF4FA3"},{"t":"tx","x":181,"y":154,"sl":1,"v":"{usageSlot1Percent}%","s":1,"f":4,"c":"#FF4FA3"},{"t":"p","x":18,"y":209,"w":153,"h":20,"sl":2,"b":"us2p","c":"#35C9FF","bg":"#101145","bc":"#4D8CFF"},{"t":"tx","x":181,"y":209,"sl":2,"v":"{usageSlot2Percent}%","s":1,"f":4,"c":"#35C9FF"},{"t":"tx","x":19,"y":138,"w":215,"sl":1,"v":"{usageSlot1Label} {usageMode}","s":1,"f":2,"ft":"shrink","c":"#FF4FA3"},{"t":"tx","x":18,"y":190,"w":216,"sl":2,"v":"{usageSlot2Label} {usageMode}","s":1,"f":2,"ft":"shrink","c":"#35C9FF"}],"bg":"#050014"}
