{"v":1,"id":"token-burner","rev":1,"bg":"#120606","p":[{"t":"r","x":0,"y":0,"w":240,"h":240,"c":"#120606"},{"t":"r","x":10,"y":10,"w":220,"h":220,"c":"#200A0A","br":28},{"t":"r","x":26,"y":27,"w":188,"h":5,"c":"#FF5A36","br":2},{"t":"tx","x":20,"y":49,"w":200,"v":"TOKEN BURNER","f":2,"s":1,"al":"center","c":"#FFB000"},{"t":"tx","x":12,"y":82,"w":216,"b":"st","nf":"compact","an":"count-up","f":4,"s":2,"al":"center","c":"#FFF1D6"},{"t":"tx","x":20,"y":147,"w":200,"v":"TODAY","s":2,"al":"center","c":"#FF5A36"},{"t":"tx","x":28,"y":184,"w":80,"v":"7 DAYS","s":1,"al":"center","c":"#A65B47"},{"t":"tx","x":132,"y":184,"w":80,"v":"30 DAYS","s":1,"al":"center","c":"#A65B47"},{"t":"tx","x":28,"y":202,"w":80,"b":"wt","nf":"compact","s":2,"al":"center","c":"#FFB000"},{"t":"tx","x":132,"y":202,"w":80,"b":"tt","nf":"compact","s":2,"al":"center","c":"#FFB000"}]}
