{"v":1,"id":"measure-worst-case","rev":1,"bg":"#000000","p":[{"t":"tx","x":4,"y":0,"w":232,"v":"Worst case line 00 {reset}","s":1,"f":2,"al":"left","c":"#FFFFFF"},{"t":"tx","x":4,"y":7,"w":232,"v":"Worst case line 01 {reset}","s":1,"f":2,"al":"left","c":"#FFFFFF"},{"t":"tx","x":4,"y":14,"w":232,"v":"Worst case line 02 {reset}","s":1,"f":2,"al":"left","c":"#FFFFFF"},{"t":"tx","x":4,"y":21,"w":232,"v":"Worst case line 03 {reset}","s":1,"f":2,"al":"left","c":"#FFFFFF"},{"t":"tx","x":4,"y":28,"w":232,"v":"Worst case line 04 {reset}","s":1,"f":2,"al":"left","c":"#FFFFFF"},{"t":"tx","x":4,"y":35,"w":232,"v":"Worst case line 05 {reset}","s":1,"f":2,"al":"left","c":"#FFFFFF"},{"t":"tx","x":4,"y":42,"w":232,"v":"Worst case line 06 {reset}","s":1,"f":2,"al":"left","c":"#FFFFFF"},{"t":"tx","x":4,"y":49,"w":232,"v":"Worst case line 07 {reset}","s":1,"f":2,"al":"left","c":"#FFFFFF"},{"t":"tx","x":4,"y":56,"w":232,"v":"Worst case line 08 {reset}","s":1,"f":2,"al":"left","c":"#FFFFFF"},{"t":"tx","x":4,"y":63,"w":232,"v":"Worst case line 09 {reset}","s":1,"f":2,"al":"left","c":"#FFFFFF"},{"t":"tx","x":4,"y":70,"w":232,"v":"Worst case line 10 {reset}","s":1,"f":2,"al":"left","c":"#FFFFFF"},{"t":"tx","x":4,"y":77,"w":232,"v":"Worst case line 11 {reset}","s":1,"f":2,"al":"left","c":"#FFFFFF"},{"t":"tx","x":4,"y":84,"w":232,"v":"Worst case line 12 {reset}","s":1,"f":2,"al":"left","c":"#FFFFFF"},{"t":"tx","x":4,"y":91,"w":232,"v":"Worst case line 13 {reset}","s":1,"f":2,"al":"left","c":"#FFFFFF"},{"t":"tx","x":4,"y":98,"w":232,"v":"Worst case line 14 {reset}","s":1,"f":2,"al":"left","c":"#FFFFFF"},{"t":"tx","x":4,"y":105,"w":232,"v":"Worst case line 15 {reset}","s":1,"f":2,"al":"left","c":"#FFFFFF"},{"t":"tx","x":4,"y":112,"w":232,"v":"Worst case line 16 {reset}","s":1,"f":2,"al":"left","c":"#FFFFFF"},{"t":"tx","x":4,"y":119,"w":232,"v":"Worst case line 17 {reset}","s":1,"f":2,"al":"left","c":"#FFFFFF"},{"t":"tx","x":4,"y":126,"w":232,"v":"Worst case line 18 {reset}","s":1,"f":2,"al":"left","c":"#FFFFFF"},{"t":"tx","x":4,"y":133,"w":232,"v":"Worst case line 19 {reset}","s":1,"f":2,"al":"left","c":"#FFFFFF"},{"t":"tx","x":4,"y":140,"w":232,"v":"Worst case line 20 {reset}","s":1,"f":2,"al":"left","c":"#FFFFFF"},{"t":"tx","x":4,"y":147,"w":232,"v":"Worst case line 21 {reset}","s":1,"f":2,"al":"left","c":"#FFFFFF"},{"t":"tx","x":4,"y":154,"w":232,"v":"Worst case line 22 {reset}","s":1,"f":2,"al":"left","c":"#FFFFFF"},{"t":"tx","x":4,"y":161,"w":232,"v":"Worst case line 23 {reset}","s":1,"f":2,"al":"left","c":"#FFFFFF"},{"t":"tx","x":4,"y":168,"w":232,"v":"Worst case line 24 {reset}","s":1,"f":2,"al":"left","c":"#FFFFFF"},{"t":"tx","x":4,"y":175,"w":232,"v":"Worst case line 25 {reset}","s":1,"f":2,"al":"left","c":"#FFFFFF"},{"t":"tx","x":4,"y":182,"w":232,"v":"Worst case line 26 {reset}","s":1,"f":2,"al":"left","c":"#FFFFFF"},{"t":"tx","x":4,"y":189,"w":232,"v":"Worst case line 27 {reset}","s":1,"f":2,"al":"left","c":"#FFFFFF"},{"t":"tx","x":4,"y":196,"w":232,"v":"Worst case line 28 {reset}","s":1,"f":2,"al":"left","c":"#FFFFFF"},{"t":"tx","x":4,"y":203,"w":232,"v":"Worst case line 29 {reset}","s":1,"f":2,"al":"left","c":"#FFFFFF"},{"t":"tx","x":4,"y":210,"w":232,"v":"Worst case line 30 {reset}","s":1,"f":2,"al":"left","c":"#FFFFFF"},{"t":"tx","x":4,"y":217,"w":232,"v":"Worst case line 31 {reset}","s":1,"f":2,"al":"left","c":"#FFFFFF"}]}
