{"v":1,"id":"claude-creature","rev":10,"p":[{"t":"tx","x":4,"y":4,"w":232,"v":"{label}","s":2,"f":2,"ft":"shrink","al":"center","c":"#FF9B7B"},{"t":"tx","x":10,"y":38,"w":110,"sl":1,"v":"{usageSlot1Label}","s":3,"ft":"shrink","c":"#FFB19B"},{"t":"tx","x":10,"y":64,"w":108,"sl":1,"v":"{usageSlot1Percent}%","s":3,"f":2,"ft":"shrink","c":"#FF8F6F"},{"t":"tx","x":10,"y":116,"w":66,"sl":1,"v":"{usageMode}","s":1,"f":2,"ft":"shrink","c":"#FFB19B"},{"t":"tx","x":120,"y":38,"w":110,"sl":2,"v":"{usageSlot2Label}","s":3,"ft":"shrink","al":"right","c":"#FFB19B"},{"t":"tx","x":122,"y":64,"w":108,"sl":2,"v":"{usageSlot2Percent}%","s":3,"f":2,"ft":"shrink","al":"right","c":"#FF8F6F"},{"t":"tx","x":164,"y":116,"w":66,"sl":2,"v":"{usageMode}","s":1,"f":2,"ft":"shrink","al":"right","c":"#FFB19B"},{"t":"r","x":9,"y":196,"w":220,"h":1,"c":"#B95D4F"},{"t":"tx","x":4,"y":199,"w":231,"sl":1,"v":"Resets in {usageSlot1Reset}","s":2,"f":2,"ft":"shrink","al":"center","c":"#FF9B7B"},{"t":"sp","x":80,"y":112,"w":77,"h":77,"bg":"#000000","a":"/themes/u/cld-i.cba","sa":{"idle":"/themes/u/cld-i.cba","coding":"/themes/u/cld-c.cba","needs_you":"/themes/u/cld-n4.cba","done":"/themes/u/cld-d4.cba","error":"/themes/u/cld-e4.cba"}}],"bg":"#000000"}
