{"v":1,"id":"token-fire","rev":7,"bg":"#050505","p":[{"t":"sp","x":0,"y":0,"w":240,"h":117,"a":"/themes/s/tf-bg.cbi"},{"t":"sp","x":96,"y":32,"w":48,"h":72,"bg":"#341505","a":"/themes/s/tf-fire.cba"},{"t":"tx","x":10,"y":119,"w":220,"v":"TOTAL TOKENS","s":1,"f":4,"ft":"shrink","al":"center","c":"#FFF2DE"},{"t":"r","x":12,"y":142,"w":216,"h":1,"c":"#51240F"},{"t":"tx","x":12,"y":151,"w":130,"v":"SESSION","s":2,"f":2,"ft":"shrink","c":"#D7B79A"},{"t":"tx","x":146,"y":151,"w":82,"b":"st","s":2,"f":2,"ft":"shrink","al":"right","c":"#FFD34A"},{"t":"tx","x":12,"y":181,"w":130,"v":"7 DAYS","s":2,"f":2,"ft":"shrink","c":"#D7B79A"},{"t":"tx","x":146,"y":181,"w":82,"b":"wt","s":2,"f":2,"ft":"shrink","al":"right","c":"#FFD34A"},{"t":"tx","x":12,"y":211,"w":130,"v":"ALL TIME","s":2,"f":2,"ft":"shrink","c":"#D7B79A"},{"t":"tx","x":146,"y":211,"w":82,"b":"tt","s":2,"f":2,"ft":"shrink","al":"right","c":"#FFD34A"}]}
