{"v":1,"id":"mini-classic","rev":1,"p":[{"t":"tx","x":0,"y":4,"w":240,"b":"l","s":2,"al":"center","c":"#999999"},{"t":"tx","x":7,"y":30,"v":"Session","s":2,"c":"#999999"},{"t":"tx","x":7,"y":66,"v":"{session}%","s":5,"c":"#CCFF00"},{"t":"tx","x":153,"y":30,"v":"Weekly","s":2,"c":"#999999"},{"t":"tx","x":141,"y":66,"v":"{weekly}%","s":5,"c":"#CCFF00"},{"t":"g","x":82,"y":122,"w":76,"h":76,"a":"/themes/mini/mini.gif"},{"t":"tx","x":24,"y":208,"w":192,"v":"Reset in {reset}","s":2,"al":"center","c":"#999999"},{"t":"tx","x":7,"y":106,"v":"left","s":2,"c":"#999999"},{"t":"tx","x":177,"y":106,"v":"left","s":2,"c":"#999999"}],"bg":"#000000"}
