{"v":1,"id":"mini-classic","rev":10,"p":[{"t":"tx","x":4,"y":2,"w":232,"b":"l","s":3,"ft":"shrink","al":"center","c":"#999999"},{"t":"tx","x":6,"y":30,"w":108,"sl":1,"v":"{usageSlot1Label}","s":3,"ft":"shrink","c":"#999999"},{"t":"tx","x":6,"y":56,"w":108,"sl":1,"v":"{usageSlot1Percent}%","s":3,"f":2,"ft":"shrink","c":"#CCFF00"},{"t":"tx","x":126,"y":30,"w":108,"sl":2,"v":"{usageSlot2Label}","s":3,"ft":"shrink","al":"right","c":"#999999"},{"t":"tx","x":126,"y":56,"w":108,"sl":2,"v":"{usageSlot2Percent}%","s":3,"f":2,"ft":"shrink","al":"right","c":"#CCFF00"},{"t":"tx","x":6,"y":106,"w":108,"sl":1,"v":"{usageMode}","s":2,"ft":"shrink","c":"#999999"},{"t":"tx","x":126,"y":106,"w":108,"sl":2,"v":"{usageMode}","s":2,"ft":"shrink","al":"right","c":"#999999"},{"t":"tx","x":4,"y":204,"w":232,"sl":1,"v":"Reset in {usageSlot1Reset}","s":2,"f":2,"ft":"shrink","al":"center","c":"#999999"},{"t":"g","x":82,"y":126,"w":76,"h":76,"a":"/themes/u/mini-4-146563.gif"},{"t":"sp","x":166,"y":132,"w":64,"h":64,"bg":"#000000","a":"/themes/u/mi-blank.cbi","sa":{"idle":"/themes/u/mi-blank.cbi","coding":"/themes/u/mi-working.cba","needs_you":"/themes/u/mi-needs.cba","done":"/themes/u/mi-finished.cba","error":"/themes/u/mi-error.cba"}}],"bg":"#000000"}
