{
  "v": 1,
  "id": "cozy-meadow",
  "rev": 4,
  "p": [
    {
      "t": "r",
      "x": 0,
      "y": 0,
      "w": 240,
      "h": 240,
      "c": "#19314A"
    },
    {
      "t": "sp",
      "x": 84,
      "y": 18,
      "w": 72,
      "h": 40,
      "a": "/themes/u/cm.cbi"
    },
    {
      "t": "tx",
      "x": 48,
      "y": 80,
      "v": "{provider}",
      "s": 3,
      "c": "#F7F1D5"
    },
    {
      "t": "tx",
      "x": 44,
      "y": 126,
      "w": 152,
      "sl": 1,
      "b": "us1l",
      "s": 3,
      "ft": "shrink",
      "c": "#F1B85B"
    },
    {
      "t": "p",
      "x": 40,
      "y": 166,
      "w": 160,
      "h": 14,
      "sl": 1,
      "b": "us1p",
      "c": "#69D28D",
      "bg": "#28465F"
    },
    {
      "t": "tx",
      "x": 82,
      "y": 193,
      "sl": 1,
      "b": "us1r",
      "s": 1,
      "c": "#B6D7E8"
    }
  ]
}
