{
  "themeSpecVersion": 1,
  "themeId": "mini-transport",
  "themeRev": 3,
  "fallbackTheme": "mini",
  "primitives": [
    {
      "type": "rect",
      "x": 0,
      "y": 0,
      "width": 240,
      "height": 240,
      "color": "#04070E"
    },
    {
      "type": "text",
      "x": 14,
      "y": 18,
      "text": "MINI",
      "fontSize": 2,
      "color": "#5CCCFf"
    },
    {
      "type": "progress",
      "x": 14,
      "y": 178,
      "width": 212,
      "height": 18,
      "color": "#A7FFC9",
      "bgColor": "#1E2738"
    }
  ]
}
