{"v":1,"id":"gauge","rev":9,"bg":"#0D0D0D","p":[{"t":"p","x":44,"y":22,"w":152,"h":152,"sl":1,"b":"usageSlot1Pace","ps":"arc","as":225,"aw":270,"at":16,"c":"#EDEDED","bg":"#2B2B2B","rc":"#C9F26B","dc":"#E7A3AC"},{"t":"tx","x":50,"y":62,"w":140,"b":"usageProviderName","s":1,"f":2,"ft":"shrink","al":"center","c":"#EDEDED"},{"t":"tx","x":70,"y":76,"w":100,"sl":1,"v":"{usageSlot1Percent}%","s":2,"f":4,"ft":"shrink","al":"center","c":"#EDEDED"},{"t":"tx","x":40,"y":125,"w":160,"sl":1,"v":"{usageSlot1Label} {usageModeShort}","s":1,"f":2,"ft":"shrink","al":"center","c":"#8C8C8C"},{"t":"tx","x":20,"y":164,"w":200,"sl":1,"b":"usageSlot1PaceText","s":1,"f":2,"ft":"shrink","al":"center","c":"#EDEDED","cs":[{"gte":100,"c":"#C9F26B"},{"gte":50,"c":"#EDEDED"},{"gte":0,"c":"#E7A3AC"}]},{"t":"tx","x":4,"y":183,"w":232,"sl":1,"b":"usageSlot1PaceFooter","s":1,"f":2,"ft":"shrink","al":"center","c":"#8C8C8C"},{"t":"r","x":14,"y":208,"w":212,"h":1,"c":"#262626"},{"t":"tx","x":14,"y":217,"w":112,"sl":2,"v":"{usageSlot2Label} {usageSlot2Percent}%","s":1,"f":2,"ft":"shrink","c":"#EDEDED"},{"t":"tx","x":110,"y":217,"w":116,"sl":2,"b":"usageSlot2PaceText","s":1,"f":2,"ft":"shrink","al":"right","c":"#EDEDED","cs":[{"gte":100,"c":"#C9F26B"},{"gte":50,"c":"#EDEDED"},{"gte":0,"c":"#E7A3AC"}]}]}
