{"v":1,"id":"duo","rev":3,"bg":"#000000","p":[{"t":"tx","x":4,"y":0,"w":232,"h":32,"b":"l","s":2,"f":2,"ft":"shrink","al":"center","va":"middle","c":"#9CA3AF"},{"t":"r","x":8,"y":37,"w":224,"h":1,"c":"#333333"},{"t":"tx","x":8,"y":42,"w":96,"h":32,"pl":1,"b":"pv1l","s":2,"f":2,"ft":"shrink","va":"middle","c":"#F8FAFC"},{"t":"tx","x":104,"y":42,"w":128,"pl":1,"v":"{pv1p}%","s":2,"f":4,"ft":"shrink","al":"right","c":"#CCFF00"},{"t":"tx","x":8,"y":84,"w":108,"pl":1,"b":"u","s":2,"c":"#9CA3AF"},{"t":"tx","x":8,"y":100,"w":232,"h":32,"pl":1,"v":"Next reset {pv1r}","s":2,"f":2,"ft":"shrink","va":"middle","c":"#9CA3AF"},{"t":"r","x":8,"y":138,"w":224,"h":1,"pl":1,"c":"#333333"},{"t":"tx","x":8,"y":144,"w":96,"h":32,"pl":2,"b":"pv2l","s":2,"f":2,"ft":"shrink","va":"middle","c":"#F8FAFC"},{"t":"tx","x":104,"y":144,"w":128,"pl":2,"v":"{pv2p}%","s":2,"f":4,"ft":"shrink","al":"right","c":"#CCFF00"},{"t":"tx","x":8,"y":186,"w":108,"pl":2,"b":"u","s":2,"c":"#9CA3AF"},{"t":"tx","x":8,"y":202,"w":232,"h":32,"pl":2,"v":"Next reset {pv2r}","s":2,"f":2,"ft":"shrink","va":"middle","c":"#9CA3AF"}]}
