{"v":1,"id":"pixel-battery-bar","rev":6,"bg":"#0A0A0B","p":[{"t":"sp","x":0,"y":0,"w":240,"h":240,"a":"/themes/u/pbb-bg.cbi"},{"t":"sp","x":28,"y":20,"w":32,"h":32,"a":"/themes/u/pbb-fb.cbi","pa":{"cursor":"/themes/u/pbb-cu.cbi","claude":"/themes/u/pbb-cl.cbi","codex":"/themes/u/pbb-xo.cbi"}},{"t":"tx","x":68,"y":20,"w":156,"h":32,"b":"l","s":2,"f":2,"ft":"shrink","va":"middle","c":"#F8FAFC"},{"t":"tx","x":28,"y":68,"w":196,"sl":1,"v":"{usageSlot1Label} {usageMode}","s":1,"f":2,"ft":"shrink","c":"#94A3B8"},{"t":"p","x":29,"y":92,"w":128,"h":26,"sl":1,"b":"us1p","c":"#22C55E","cs":[{"gte":75,"c":"#22C55E"},{"gte":50,"c":"#FACC15"},{"gte":25,"c":"#F97316"},{"gte":0,"c":"#EF4444"}],"bg":"#1E293B","bc":"#1E293B"},{"t":"tx","x":173,"y":97,"w":42,"sl":1,"v":"{usageSlot1Percent}%","s":2,"f":2,"ft":"shrink","al":"right","c":"#F8FAFC"},{"t":"tx","x":28,"y":134,"w":196,"sl":2,"v":"{usageSlot2Label} {usageMode}","s":1,"f":2,"ft":"shrink","c":"#94A3B8"},{"t":"p","x":29,"y":158,"w":128,"h":26,"sl":2,"b":"us2p","c":"#22C55E","cs":[{"gte":75,"c":"#22C55E"},{"gte":50,"c":"#FACC15"},{"gte":25,"c":"#F97316"},{"gte":0,"c":"#EF4444"}],"bg":"#1E293B","bc":"#1E293B"},{"t":"tx","x":173,"y":163,"w":42,"sl":2,"v":"{usageSlot2Percent}%","s":2,"f":2,"ft":"shrink","al":"right","c":"#F8FAFC"},{"t":"tx","x":16,"y":212,"w":208,"sl":1,"v":"Reset in {usageSlot1Reset}","s":1,"f":2,"ft":"shrink","al":"center","c":"#94A3B8"}]}