{"v":1,"id":"pixel-battery","rev":22,"bg":"#0A0A0B","p":[{"t":"sp","x":0,"y":0,"w":240,"h":240,"a":"/themes/u/pba-bg.cbi"},{"t":"sp","x":28,"y":15,"w":32,"h":32,"a":"/themes/u/pba-fb.cbi","pa":{"cursor":"/themes/u/pba-cu.cbi","claude":"/themes/u/pba-cl.cbi","codex":"/themes/u/pba-xo.cbi"}},{"t":"tx","x":68,"y":15,"w":156,"h":32,"b":"l","s":2,"f":2,"ft":"shrink","va":"middle","c":"#F8FAFC"},{"t":"tx","x":16,"y":49,"w":208,"sl":1,"v":"{usageSlot1Label}","s":1,"f":4,"ft":"shrink","c":"#94A3B8","h":26,"va":"bottom"},{"t":"tx","x":130,"y":106,"w":104,"sl":1,"b":"usageSlot1PaceText","s":1,"f":2,"ft":"shrink","al":"right","c":"#94A3B8","cs":[{"gte":100,"c":"#86EFAC"},{"gte":50,"c":"#94A3B8"},{"gte":0,"c":"#FCA5A5"}]},{"t":"p","x":29,"y":79,"w":128,"h":26,"sl":1,"b":"usageSlot1Pace","c":"#22C55E","cs":[{"gte":75,"c":"#22C55E"},{"gte":50,"c":"#FACC15"},{"gte":25,"c":"#F97316"},{"gte":0,"c":"#EF4444"}],"bg":"#1E293B","bc":"#1E293B","ps":"segments","sg":16,"gg":2,"rc":"#D9F99D","dc":"#F87171"},{"t":"tx","x":168,"y":79,"w":48,"sl":1,"v":"{usageSlot1Percent}","s":2,"f":2,"al":"right","c":"#F8FAFC","h":26,"va":"middle"},{"t":"tx","x":219,"y":79,"w":10,"h":26,"sl":1,"v":"%","s":1,"f":2,"va":"middle","c":"#F8FAFC"},{"t":"tx","x":16,"y":129,"w":208,"sl":2,"v":"{usageSlot2Label}","s":1,"f":4,"ft":"shrink","c":"#94A3B8","h":26,"va":"bottom"},{"t":"tx","x":130,"y":186,"w":104,"sl":2,"b":"usageSlot2PaceText","s":1,"f":2,"ft":"shrink","al":"right","c":"#94A3B8","cs":[{"gte":100,"c":"#86EFAC"},{"gte":50,"c":"#94A3B8"},{"gte":0,"c":"#FCA5A5"}]},{"t":"p","x":29,"y":159,"w":128,"h":26,"sl":2,"b":"usageSlot2Pace","c":"#22C55E","cs":[{"gte":75,"c":"#22C55E"},{"gte":50,"c":"#FACC15"},{"gte":25,"c":"#F97316"},{"gte":0,"c":"#EF4444"}],"bg":"#1E293B","bc":"#1E293B","ps":"segments","sg":16,"gg":2,"rc":"#D9F99D","dc":"#F87171"},{"t":"tx","x":168,"y":159,"w":48,"sl":2,"v":"{usageSlot2Percent}","s":2,"f":2,"al":"right","c":"#F8FAFC","h":26,"va":"middle"},{"t":"tx","x":219,"y":159,"w":10,"h":26,"sl":2,"v":"%","s":1,"f":2,"va":"middle","c":"#F8FAFC"},{"t":"tx","x":6,"y":202,"w":228,"sl":1,"v":"Reset in {usageSlot1Reset}","s":2,"f":2,"ft":"shrink","al":"center","c":"#94A3B8","h":34,"va":"middle"}]}
