{"v":1,"id":"two-limits","rev":3,"bg":"#0D0D0D","p":[{"t":"tx","x":14,"y":7,"w":212,"sl":1,"v":"{usageSlot1Label} {usageModeShort}","s":1,"f":2,"ft":"shrink","c":"#EDEDED"},{"t":"tx","x":14,"y":27,"w":212,"sl":1,"v":"{usageSlot1Percent}%","s":2,"f":2,"ft":"shrink","c":"#EDEDED"},{"t":"p","x":14,"y":66,"w":212,"h":8,"sl":1,"b":"usageSlot1Pace","c":"#EDEDED","bg":"#2B2B2B","bc":"#2B2B2B","rc":"#C9F26B","dc":"#E7A3AC","br":3},{"t":"tx","x":14,"y":88,"w":212,"sl":1,"b":"usageSlot1PaceText","s":1,"f":1,"ft":"shrink","c":"#EDEDED","cs":[{"gte":100,"c":"#C9F26B"},{"gte":50,"c":"#EDEDED"},{"gte":0,"c":"#E7A3AC"}]},{"t":"r","x":14,"y":121,"w":212,"h":1,"c":"#262626"},{"t":"tx","x":14,"y":127,"w":212,"sl":2,"v":"{usageSlot2Label} {usageModeShort}","s":1,"f":2,"ft":"shrink","c":"#EDEDED"},{"t":"tx","x":14,"y":147,"w":212,"sl":2,"v":"{usageSlot2Percent}%","s":2,"f":2,"ft":"shrink","c":"#EDEDED"},{"t":"p","x":14,"y":186,"w":212,"h":8,"sl":2,"b":"usageSlot2Pace","c":"#EDEDED","bg":"#2B2B2B","bc":"#2B2B2B","rc":"#C9F26B","dc":"#E7A3AC","br":3},{"t":"tx","x":14,"y":208,"w":212,"sl":2,"b":"usageSlot2PaceText","s":1,"f":1,"ft":"shrink","c":"#EDEDED","cs":[{"gte":100,"c":"#C9F26B"},{"gte":50,"c":"#EDEDED"},{"gte":0,"c":"#E7A3AC"}]},{"t":"tx","x":14,"y":222,"w":212,"b":"l","s":1,"f":1,"ft":"shrink","c":"#8C8C8C"}]}
