{"v":1,"id":"reset-countdown","rev":8,"bg":"#001A24","p":[{"t":"sp","x":0,"y":0,"w":240,"h":128,"a":"/themes/s/rcf-top.cbi"},{"t":"sp","x":0,"y":128,"w":240,"h":112,"a":"/themes/s/rcf-bottom.cbi"},{"t":"tx","x":112,"y":56,"w":120,"v":"{usageProviderName}","s":1,"f":4,"ft":"shrink","al":"center","c":"#A8E0C7"},{"t":"tx","x":112,"y":102,"w":120,"v":"RESET IN","s":1,"f":2,"ft":"shrink","al":"center","c":"#FFF5D7","sl":1},{"t":"tx","x":112,"y":126,"w":120,"v":"{usageSlot1ResetFull}","s":4,"f":2,"ft":"shrink","al":"center","c":"#FFE080","sl":1}]}
