{"v":1,"id":"company-demo","rev":2,"bg":"#0B1220","p":[{"t":"tx","x":4,"y":10,"w":232,"v":"COMPANY DEMO","s":1,"f":4,"al":"center","c":"#38BDF8"},{"t":"r","x":24,"y":34,"w":192,"h":1,"c":"#1E293B"},{"t":"tx","x":4,"y":44,"w":232,"h":32,"b":"l","s":2,"f":2,"ft":"shrink","al":"center","va":"middle","c":"#CBD5E1"},{"t":"tx","x":2,"y":84,"w":236,"h":78,"b":"st","s":3,"f":4,"ft":"shrink","al":"center","va":"middle","c":"#F8FAFC"},{"t":"tx","x":4,"y":160,"w":232,"v":"SESSION TOKENS","s":1,"f":4,"al":"center","c":"#94A3B8"},{"t":"tx","x":4,"y":196,"w":232,"h":32,"sl":1,"v":"Reset in {usageSlot1Reset}","s":2,"f":2,"ft":"shrink","al":"center","va":"middle","c":"#94A3B8"}]}