{"v":1,"id":"pace-meter","rev":1,"bg":"#0D0D0D","p":[{"t":"tx","x":14,"y":5,"w":130,"b":"l","s":1,"f":2,"ft":"shrink","c":"#8C8C8C"},{"t":"tx","x":14,"y":26,"w":112,"sl":1,"v":"{usageSlot1Percent}%","s":2,"f":4,"ft":"shrink","c":"#EDEDED"},{"t":"tx","x":110,"y":32,"w":116,"sl":1,"v":"{usageSlot1Label} {usageModeShort}","s":1,"f":2,"ft":"shrink","al":"right","c":"#EDEDED"},{"t":"tx","x":110,"y":52,"w":116,"sl":1,"v":"resets {usageSlot1Reset}","s":1,"f":2,"ft":"shrink","al":"right","c":"#8C8C8C"},{"t":"p","x":13,"y":77,"w":214,"h":14,"br":3,"sl":1,"b":"usageSlot1Pace","c":"#EDEDED","bg":"#2B2B2B","bc":"#2B2B2B","rc":"#C9F26B","dc":"#E7A3AC"},{"t":"tx","x":14,"y":97,"w":150,"sl":1,"b":"usageSlot1PaceText","s":1,"f":2,"ft":"shrink","c":"#EDEDED","cs":[{"gte":100,"c":"#C9F26B"},{"gte":50,"c":"#EDEDED"},{"gte":0,"c":"#E7A3AC"}]},{"t":"tx","x":150,"y":97,"w":76,"sl":1,"b":"usageSlot1PaceRunsOut","s":1,"f":2,"ft":"shrink","al":"right","c":"#8C8C8C"},{"t":"r","x":14,"y":121,"w":212,"h":1,"c":"#262626"},{"t":"tx","x":14,"y":133,"w":112,"sl":2,"v":"{usageSlot2Percent}%","s":2,"f":4,"ft":"shrink","c":"#EDEDED"},{"t":"tx","x":110,"y":139,"w":116,"sl":2,"v":"{usageSlot2Label} {usageModeShort}","s":1,"f":2,"ft":"shrink","al":"right","c":"#EDEDED"},{"t":"tx","x":110,"y":159,"w":116,"sl":2,"v":"resets {usageSlot2Reset}","s":1,"f":2,"ft":"shrink","al":"right","c":"#8C8C8C"},{"t":"p","x":13,"y":184,"w":214,"h":14,"br":3,"sl":2,"b":"usageSlot2Pace","c":"#EDEDED","bg":"#2B2B2B","bc":"#2B2B2B","rc":"#C9F26B","dc":"#E7A3AC"},{"t":"tx","x":14,"y":204,"w":150,"sl":2,"b":"usageSlot2PaceText","s":1,"f":2,"ft":"shrink","c":"#EDEDED","cs":[{"gte":100,"c":"#C9F26B"},{"gte":50,"c":"#EDEDED"},{"gte":0,"c":"#E7A3AC"}]},{"t":"tx","x":150,"y":204,"w":76,"sl":2,"b":"usageSlot2PaceRunsOut","s":1,"f":2,"ft":"shrink","al":"right","c":"#8C8C8C"}]}
