{"v":1,"id":"fuel","rev":16,"bg":"#000000","p":[{"t":"sp","x":0,"y":0,"w":240,"h":240,"a":"/themes/u/fuef-e3a1a9.cbi"},{"t":"sp","x":104,"y":90,"w":32,"h":32,"a":"/themes/u/fuea-cad422.cbi","pa":{"cursor":"/themes/u/fuec-906d24.cbi","claude":"/themes/u/fuel-857eb2.cbi","codex":"/themes/u/fueo-03ed77.cbi"}},{"t":"p","x":36,"y":66,"w":168,"h":168,"sl":1,"b":"us1p","ps":"needle","as":270,"aw":180,"a":"/themes/u/fuen-c9cc36.cbi"},{"t":"r","x":104,"y":134,"w":32,"h":32,"br":16,"c":"#3C4044"},{"t":"r","x":107,"y":137,"w":26,"h":26,"br":13,"c":"#292C2B"},{"t":"tx","x":8,"y":2,"w":224,"h":32,"b":"l","s":2,"f":2,"ft":"shrink","al":"center","va":"middle","c":"#E6E8EE"},{"t":"tx","x":8,"y":194,"w":224,"h":32,"sl":1,"v":"{usageSlot1Percent}%","s":2,"f":2,"ft":"shrink","al":"center","va":"middle","c":"#E6E8EE"}]}