{
  "v": 1,
  "id": "measure-screensaver-countdown",
  "rev": 1,
  "bg": "#000000",
  "p": [
    {"t": "tx", "x": 20, "y": 34, "w": 200, "v": "{time}", "s": 4, "f": 2, "al": "center", "c": "#FFFFFF"},
    {"t": "tx", "x": 20, "y": 96, "w": 200, "v": "{label}", "s": 1, "f": 2, "al": "center", "c": "#8899AA"},
    {"t": "tx", "x": 20, "y": 128, "w": 200, "v": "Resets in", "s": 1, "f": 2, "al": "center", "c": "#8899AA"},
    {"t": "tx", "x": 20, "y": 150, "w": 200, "b": "reset", "s": 3, "f": 2, "al": "center", "c": "#69D28D"},
    {"t": "r", "x": 40, "y": 206, "w": 160, "h": 2, "c": "#243447"}
  ]
}
