{"v":1,"id":"clippy","rev":6,"p":[{"t":"sp","x":0,"y":0,"w":240,"h":240,"c":"#111111","a":"/themes/u/cp-bg.cbi"},{"t":"tx","x":8,"y":6,"w":164,"v":"{label}","s":1,"f":2,"ft":"shrink","c":"#FFFFFF","h":26,"va":"middle"},{"t":"sp","x":83,"y":54,"w":74,"h":74,"bg":"#C6C3BD","a":"/themes/u/cp-i6.cba","sa":{"idle":"/themes/u/cp-i6.cba","coding":"/themes/u/cp-c6.cba","needs_you":"/themes/u/cp-n6.cba","done":"/themes/u/cp-d6.cba","error":"/themes/u/cp-e6.cba"}},{"t":"p","x":27,"y":166,"w":146,"h":14,"sl":1,"b":"us1p","ps":"segments","sg":28,"gg":1,"c":"#0FA514","bg":"#DAD7D0","bc":"#FFFFFF"},{"t":"tx","x":181,"y":157,"sl":1,"v":"{usageSlot1Percent}%","s":2,"f":2,"c":"#111111"},{"t":"p","x":27,"y":214,"w":146,"h":14,"sl":2,"b":"us2p","ps":"segments","sg":28,"gg":1,"c":"#0FA514","bg":"#DAD7D0","bc":"#FFFFFF"},{"t":"tx","x":181,"y":208,"sl":2,"v":"{usageSlot2Percent}%","s":2,"f":2,"c":"#111111"},{"t":"tx","x":18,"y":142,"w":216,"sl":1,"v":"{usageSlot1Label} {usageMode}","s":1,"f":2,"ft":"shrink","c":"#111111"},{"t":"tx","x":18,"y":196,"w":216,"sl":2,"v":"{usageSlot2Label} {usageMode}","s":1,"f":2,"ft":"shrink","c":"#111111"}],"bg":"#000000"}
