{"v":1,"id":"tiny-office","rev":8,"bg":"#0E0C1E","p":[{"t":"sp","x":0,"y":0,"w":240,"h":240,"a":"/themes/u/to-bg.cbi"},{"t":"r","x":0,"y":0,"w":240,"h":32,"c":"#0E0C1E"},{"t":"r","x":0,"y":32,"w":240,"h":4,"c":"#3A2F5C"},{"t":"sp","x":0,"y":36,"w":80,"h":46,"bg":"#0E0C1E","sa":{"idle":"/themes/u/to-i0.cbi","coding":"/themes/u/to-c0.cbi","needs_you":"/themes/u/to-n0.cba","done":"/themes/u/to-d0.cba","error":"/themes/u/to-e0.cbi"}},{"t":"sp","x":80,"y":36,"w":80,"h":46,"bg":"#0E0C1E","sa":{"idle":"/themes/u/to-i1.cba","coding":"/themes/u/to-c1.cba","needs_you":"/themes/u/to-n1.cba","done":"/themes/u/to-d1.cba","error":"/themes/u/to-e1.cba"}},{"t":"sp","x":160,"y":36,"w":80,"h":46,"bg":"#0E0C1E","sa":{"idle":"/themes/u/to-i2.cbi","coding":"/themes/u/to-c2.cbi","needs_you":"/themes/u/to-n2.cba","done":"/themes/u/to-d2.cba","error":"/themes/u/to-e2.cbi"}},{"t":"sp","x":0,"y":82,"w":80,"h":46,"bg":"#0E0C1E","sa":{"idle":"/themes/u/to-i3.cbi","coding":"/themes/u/to-c3.cbi","needs_you":"/themes/u/to-n3.cba","done":"/themes/u/to-d3.cbi","error":"/themes/u/to-e3.cbi"}},{"t":"sp","x":80,"y":82,"w":80,"h":46,"bg":"#0E0C1E","sa":{"idle":"/themes/u/to-i4.cba","coding":"/themes/u/to-c4.cba","needs_you":"/themes/u/to-n4.cba","done":"/themes/u/to-d4.cbi","error":"/themes/u/to-e4.cbi"}},{"t":"sp","x":160,"y":82,"w":80,"h":46,"bg":"#0E0C1E","sa":{"idle":"/themes/u/to-i5.cbi","coding":"/themes/u/to-c5.cbi","needs_you":"/themes/u/to-n5.cba","done":"/themes/u/to-d5.cbi","error":"/themes/u/to-e5.cbi"}},{"t":"tx","x":4,"y":0,"w":232,"b":"l","s":2,"f":2,"ft":"shrink","al":"center","c":"#FFE08A","h":32,"va":"middle"},{"t":"tx","x":8,"y":130,"w":144,"sl":1,"v":"{usageSlot1Label}","s":2,"f":2,"ft":"shrink","c":"#4AE3FF","h":32,"va":"middle"},{"t":"tx","x":156,"y":130,"w":76,"sl":1,"v":"{usageSlot1Percent}%","s":2,"f":2,"ft":"shrink","al":"right","c":"#FFFFFF","h":32,"va":"middle"},{"t":"p","x":8,"y":163,"w":224,"h":5,"sl":1,"b":"us1p","ps":"segments","sg":28,"gg":2,"c":"#4AE3FF","bg":"#2A2348","bc":"#2A2348"},{"t":"tx","x":8,"y":170,"w":144,"sl":2,"v":"{usageSlot2Label}","s":2,"f":2,"ft":"shrink","c":"#FF7AD9","h":32,"va":"middle"},{"t":"tx","x":156,"y":170,"w":76,"sl":2,"v":"{usageSlot2Percent}%","s":2,"f":2,"ft":"shrink","al":"right","c":"#FFFFFF","h":32,"va":"middle"},{"t":"p","x":8,"y":203,"w":224,"h":5,"sl":2,"b":"us2p","ps":"segments","sg":28,"gg":2,"c":"#FF7AD9","bg":"#2A2348","bc":"#2A2348"},{"t":"tx","x":8,"y":216,"w":60,"v":"{usageMode}","s":1,"f":2,"ft":"shrink","c":"#B9A4E6"},{"t":"tx","x":72,"y":208,"w":160,"sl":1,"v":"Reset {usageSlot1Reset}","s":2,"f":2,"ft":"shrink","al":"right","c":"#FFE08A","h":32,"va":"middle"}]}
