{"v":1,"id":"night-clock","rev":4,"bg":"#0A0F16","p":[{"t":"tx","x":2,"y":28,"w":236,"b":"tm","s":3,"f":4,"ft":"shrink","al":"center","c":"#FFF3DC"},{"t":"r","x":24,"y":134,"w":192,"h":1,"c":"#5A664B"},{"t":"tx","x":24,"y":141,"w":192,"v":"NEXT RESETS:","s":1,"f":2,"al":"center","c":"#F5F1E4"},{"t":"tx","x":24,"y":163,"w":100,"pl":1,"b":"pv1l","s":2,"f":2,"ft":"shrink","c":"#F5EFDC"},{"t":"tx","x":124,"y":163,"w":92,"pl":1,"b":"pv1r","s":2,"f":2,"ft":"shrink","al":"right","c":"#A9B78C"},{"t":"r","x":24,"y":199,"w":192,"h":1,"pl":1,"c":"#414B39"},{"t":"tx","x":24,"y":205,"w":100,"pl":2,"b":"pv2l","s":2,"f":2,"ft":"shrink","c":"#F5EFDC"},{"t":"tx","x":124,"y":205,"w":92,"pl":2,"b":"pv2r","s":2,"f":2,"ft":"shrink","al":"right","c":"#A9B78C"},{"t":"r","x":24,"y":238,"w":192,"h":1,"pl":2,"c":"#414B39"}]}
